{
  "stgy_name": "WinningSession_Hedge",
  "module_name": "WinningSessionStrategy",
  "ga_exec" : true,
  "ga_exec_mode" : "BASIC",
  "ga_exec_obj" : "PROFIT",
  "bt_start": "2018-10-01T08:59:00",
  "bt_end": "2023-12-31T08:59:00",
  "markets": ["KRW-ADA","KRW-XRP"],
  "ga_markets" : true,
  "cdl_type": 60,
  "init_balance": 10000000,
  "slippage" : 0.0008,
  "bt_times" : ["08:59"],
  "vola": {
    "support": true,
    "vol_tgt": 0.04,
    "ga_vol_tgt" : [0.02,0.03,0.04]
  },
  "timeframe":{
    "support": true,
    "timeframes": ["00:59", "01:59", "02:59", "03:59", "04:59", "05:59","06:59",
                      "07:59", "08:59", "09:59", "10:59", "11:59", "12:59","13:59",
                      "14:59", "15:59", "16:59", "17:59", "18:59", "19:59","20:59",
                      "21:59", "22:59", "23:59"],
    "timegap": 1,
    "ga_timeframes" : true,
    "ga_timegap": [1 , 5]
  },
  "fixed": {
    "support": false,
    "hdge": true,
    "trade_ratio": 0.4,
    "ga_trade_ratio" : [0.2, 0.6]
  },
  "weighted": {
    "support": false,
    "top_n": [0.6,0.3,0.1],
    "ga_top_n" : [[0.3, 0.5], [0.2, 0.3],[0.1, 0.2]]
  },
  "stop_loss": {
    "support": false,
    "ratio": -0.04,
    "ga_ratio": [-0.1, -0.01]
  },
  "trailing_stop": {
    "support": false,
    "ratio": -0.02,
    "ga_ratio": [-0.1, -0.01]
  },
  "take_profit": {
    "support": false,
    "ratio": 0.07,
    "ga_ratio": [0.03, 0.1]
  },
  "vars": {
    "ma1": {"func": "sma", "params": [5], "cdl_type": 1474, "sources": ["close"], "unary": true,
            "ga_params": [[3,50, "Integer"]], "ga_cdl_types": [60, 240, 1440, 1474], "ga_sources" : ["open", "high", "low", "close"]}
  },
  "buy_systems": {
    "system1": {"alias": "ma1", "left": "close", "op": ">", "right": "ma1"}
  },
  "buy_system_op": "system1",
  "sell_systems": {
    "system1": {"alias": "ma1", "left": "close", "op": "<", "right": "ma1"}
  },
  "sell_system_op": "system1"
}