{
  "stgy_name": "WinningSession_Day",
  "module_name": "WinningSessionStrategy",
  "ga_exec" : true,
  "ga_exec_mode" : "ADVANCED",
  "ga_exec_obj" : "PROFIT",
  "bt_start": "2018-10-01T08:59:00",
  "bt_end": "2023-12-31T08:59:00",
  "markets": ["KRW-BTC", "KRW-ETH", "KRW-XRP"],
  "ga_markets" : true,
  "cdl_type": 30,
  "init_balance": 10000000,
  "slippage" : 0.0008,
  "bt_times" : ["08:59"],
  "vola": {
    "support": true,
    "vol_tgt": 0.04,
    "ga_vol_tgt" : [0.02, 0.04]
  },
  "timeframe":{
    "support": false,
    "timeframes": ["00:59", "01:59", "02:59", "03:59", "04:59", "05:59","06:59",
                      "07:59", "08:59", "09:59", "10:59", "11:59", "12:59","13:59",
                      "14:59", "15:59", "16:59", "17:59", "18:59", "19:59","20:59",
                      "21:59", "22:59", "23:59"],
    "timegap": 1,
    "ga_timeframes" : true,
    "ga_timegap": [1 , 5]
  },
  "fixed": {
    "support": false,
    "hdge": false,
    "trade_ratio": 0.4,
    "ga_trade_ratio" : [0.2, 0.6]
  },
  "weighted": {
    "support": false,
    "top_n": [0.6,0.3,0.1],
    "ga_top_n" : [[0.3, 0.5], [0.2, 0.3],[0.1, 0.2]]
  },
  "stop_loss": {
    "support": false,
    "ratio": -0.04,
    "ga_ratio": [-0.1, -0.01]
  },
  "trailing_stop": {
    "support": false,
    "ratio": -0.10,
    "ga_ratio": [-0.1, -0.01]
  },
  "take_profit": {
    "support": false,
    "ratio": 0.07,
    "ga_ratio": [0.03, 0.1]
  },
  "vars": {
    "base_time" : "08:59",
    "ga_base_time" : ["00:59", "01:59", "02:59", "03:59", "04:59", "05:59","06:59",
                      "07:59", "08:59", "09:59", "10:59", "11:59", "12:59","13:59",
                      "14:59", "15:59", "16:59", "17:59", "18:59", "19:59","20:59",
                      "21:59", "22:59", "23:59"],
    "base_time2" : "08:59",
    "ga_base_time2" : ["00:59", "01:59", "02:59", "03:59", "04:59", "05:59","06:59",
                      "07:59", "08:59", "09:59", "10:59", "11:59", "12:59","13:59",
                      "14:59", "15:59", "16:59", "17:59", "18:59", "19:59","20:59",
                      "21:59", "22:59", "23:59"],
    "base_time3" : "08:59",
    "ga_base_time3" : ["00:59", "01:59", "02:59", "03:59", "04:59", "05:59","06:59",
                      "07:59", "08:59", "09:59", "10:59", "11:59", "12:59","13:59",
                      "14:59", "15:59", "16:59", "17:59", "18:59", "19:59","20:59",
                      "21:59", "22:59", "23:59"],
    "base_time4" : "08:59",
    "ga_base_time4" : ["00:59", "01:59", "02:59", "03:59", "04:59", "05:59","06:59",
                      "07:59", "08:59", "09:59", "10:59", "11:59", "12:59","13:59",
                      "14:59", "15:59", "16:59", "17:59", "18:59", "19:59","20:59",
                      "21:59", "22:59", "23:59"],
    "sell_time" : "08:59",
    "ga_sell_time" : ["00:59", "01:59", "02:59", "03:59", "04:59", "05:59","06:59",
                  "07:59", "08:59", "09:59", "10:59", "11:59", "12:59","13:59",
                  "14:59", "15:59", "16:59", "17:59", "18:59", "19:59","20:59",
                  "21:59", "22:59", "23:59"],
    "sell_time2" : "08:59",
    "ga_sell_time2" : ["00:59", "01:59", "02:59", "03:59", "04:59", "05:59","06:59",
                  "07:59", "08:59", "09:59", "10:59", "11:59", "12:59","13:59",
                  "14:59", "15:59", "16:59", "17:59", "18:59", "19:59","20:59",
                  "21:59", "22:59", "23:59"],
    "sell_time3" : "08:59",
    "ga_sell_time3" : ["00:59", "01:59", "02:59", "03:59", "04:59", "05:59","06:59",
                  "07:59", "08:59", "09:59", "10:59", "11:59", "12:59","13:59",
                  "14:59", "15:59", "16:59", "17:59", "18:59", "19:59","20:59",
                  "21:59", "22:59", "23:59"],
    "sell_time4" : "08:59",
    "ga_sell_time4" : ["00:59", "01:59", "02:59", "03:59", "04:59", "05:59","06:59",
                  "07:59", "08:59", "09:59", "10:59", "11:59", "12:59","13:59",
                  "14:59", "15:59", "16:59", "17:59", "18:59", "19:59","20:59",
                  "21:59", "22:59", "23:59"],
    "ma": {"func": "sma", "params": [3], "cdl_type": 60, "sources": ["close"], "unary": true,
            "ga_params": [[3,200, "Integer"]], "ga_sources" : ["open", "high", "low", "close"]}
  },
  "buy_systems": {
    "system1": {"alias": "time", "left": "time", "op": "==", "right": "base_time"},
    "system2": {"alias": "time2", "left": "time", "op": "==", "right": "base_time2"},
    "system3": {"alias": "time3", "left": "time", "op": "==", "right": "base_time"},
    "system4": {"alias": "time4", "left": "time", "op": "==", "right": "base_time2"},
    "system5": {"alias": "ma", "left": "close", "op": ">", "right": "ma"}
  },
  "buy_system_op": "(system1 or system2 or system3 or system4) and system5",
  "sell_systems": {
    "system1": {"alias": "time", "left": "time", "op": "==", "right": "sell_time"},
    "system2": {"alias": "time2", "left": "time", "op": "==", "right": "sell_time2"},
    "system3": {"alias": "time3", "left": "time", "op": "==", "right": "base_time"},
    "system4": {"alias": "time4", "left": "time", "op": "==", "right": "base_time2"},
    "system5": {"alias": "ma2", "left": "close", "op": "<", "right": "ma"}
  },
  "sell_system_op": "(system1 or system2 or system3 or system4) and system5"
}