{
  "stgy_name": "SWKimStrategy1_Hdge",
  "module_name": "SWKimStrategy",
  "ga_exec" : true,
  "ga_exec_mode" : "BEST_EFFORT",
  "ga_exec_obj" : "BALANCED",
  "bt_start": "2018-10-01T08:59:00",
  "bt_end": "2024-11-25T08:59:00",
  "markets": ["KRW-BTC", "KRW-ETH", "KRW-XRP"],
  "ga_markets" : false,
  "cdl_type": 60,
  "init_balance": 10000000,
  "slippage" : 0.005,
  "bt_times" : ["08:59", "16:59"],
  "vola": {
    "support": true,
    "vol_tgt": 0.02
  },
  "timeframe":{
    "support": true,
    "timeframes": ["00:59", "04:59", "08:59", "12:59", "16:59", "20:59", "23:59"],
    "timegap": 1,
    "ga_timeframes" : true,
    "ga_timegap": [1 , 5]
  },
  "fixed": {
    "support": false,
    "hdge": false,
    "trade_ratio": 0.4
  },
  "weighted": {
    "support": false,
    "top_n": [0.6,0.3,0.1]
  },
  "stop_loss": {
    "support": false,
    "ratio": -0.04
  },
  "trailing_stop": {
    "support": false,
    "ratio": -0.02
  },
  "take_profit": {
    "support": false,
    "ratio": 0.07
  },
  "vars": {
    "ma0": {"func": "sma", "params": [3], "cdl_type": 1474, "sources": ["close"], "unary": true,
            "ga_params": [[5,200, "Integer"]]},
    "pdi1": {"func": "PLUS_DI", "params": [14], "cdl_type": 240, "sources": ["high","low","close"], "unary": true,
            "ga_params": [[5,200, "Integer"]]},
    "mdi1": {"func": "MINUS_DI", "params": [14], "cdl_type": 240, "sources": ["high","low","close"], "unary": true,
            "ga_params": [[5,200, "Integer"]]},
    "pdi2": {"func": "PLUS_DI", "params": [14], "cdl_type": 240, "sources": ["high","low","close"], "unary": true,
            "ga_params": [[5,200, "Integer"]]},
    "mdi2": {"func": "MINUS_DI", "params": [14], "cdl_type": 240, "sources": ["high","low","close"], "unary": true,
            "ga_params": [[5,200, "Integer"]]},
    "pdi3": {"func": "PLUS_DI", "params": [14], "cdl_type": 240, "sources": ["high","low","close"], "unary": true,
            "ga_params": [[5,200, "Integer"]]},
    "mdi3": {"func": "MINUS_DI", "params": [14], "cdl_type": 240, "sources": ["high","low","close"], "unary": true,
            "ga_params": [[5,200, "Integer"]]},
    "pdi4": {"func": "PLUS_DI", "params": [14], "cdl_type": 240, "sources": ["high","low","close"], "unary": true,
            "ga_params": [[5,200, "Integer"]]},
    "mdi4": {"func": "MINUS_DI", "params": [14], "cdl_type": 240, "sources": ["high","low","close"], "unary": true,
            "ga_params": [[5,200, "Integer"]]},
    "pdi5": {"func": "PLUS_DI", "params": [14], "cdl_type": 240, "sources": ["high","low","close"], "unary": true,
            "ga_params": [[5,200, "Integer"]]},
    "mdi5": {"func": "MINUS_DI", "params": [14], "cdl_type": 240, "sources": ["high","low","close"], "unary": true,
            "ga_params": [[5,200, "Integer"]]},
    "pdi6": {"func": "PLUS_DI", "params": [14], "cdl_type": 240, "sources": ["high","low","close"], "unary": true,
            "ga_params": [[5,200, "Integer"]]},
    "mdi6": {"func": "MINUS_DI", "params": [14], "cdl_type": 240, "sources": ["high","low","close"], "unary": true,
            "ga_params": [[5,200, "Integer"]]}
  },
  "buy_systems": {
    "system0": {"alias": "ma0", "left": "close", "op": ">", "right": "ma0"},
    "system1": {"alias": "di1", "left": "pdi1", "op": ">", "right": "mdi1", "market" : "KRW-BTC"},
    "system2": {"alias": "di2", "left": "pdi2", "op": ">", "right": "mdi2", "market" : "KRW-ETH"},
    "system3": {"alias": "di3", "left": "pdi3", "op": ">", "right": "mdi3", "market" : "KRW-XRP"},
    "system4": {"alias": "di4", "left": "pdi4", "op": ">", "right": "mdi4", "market" : "KRW-BTC"},
    "system5": {"alias": "di5", "left": "pdi5", "op": ">", "right": "mdi5", "market" : "KRW-ETH"},
    "system6": {"alias": "di6", "left": "pdi6", "op": ">", "right": "mdi6", "market" : "KRW-XRP"}
  },
  "buy_system_op": "(system0 and (system1 or system2 or system3)) or (not system0 and (system4 or system5 or system6))",
  "sell_systems": {
    "system0": {"alias": "ma0", "left": "close", "op": ">", "right": "ma0"},
    "system1": {"alias": "di1", "left": "pdi1", "op": "<", "right": "mdi1", "market" : "KRW-BTC"},
    "system2": {"alias": "di2", "left": "pdi2", "op": "<", "right": "mdi2", "market" : "KRW-BTC"},
    "system3": {"alias": "di3", "left": "pdi3", "op": "<", "right": "mdi3", "market" : "KRW-ETH"},
    "system4": {"alias": "di4", "left": "pdi4", "op": "<", "right": "mdi4", "market" : "KRW-ETH"},
    "system5": {"alias": "di5", "left": "pdi5", "op": "<", "right": "mdi5", "market" : "KRW-XRP"},
    "system6": {"alias": "di6", "left": "pdi6", "op": "<", "right": "mdi6", "market" : "KRW-XRP"}
  },
  "sell_system_op": "(system0 and (system1 or system2 or system3)) or (not system0 and (system4 or system5 or system6))"
}